{
  "plan_id": "UHC_CHOICE_PLUS_HSA_GOLD_1700",
  "plan_name": "UnitedHealthcare\u00ae UHC Choice Plus HSA Gold 1700-4",
  "carrier": "UnitedHealthcare",
  "plan_type": "POS",
  "plan_year": 2026,
  "effective_date": "2026-01-01",
  "expiry_date": "2026-12-31",
  "coverage_period": {
    "start_date": "2026-01-01",
    "end_date": "2026-12-31"
  },
  "market": "small_group",
  "network_tiers": [
    {
      "tier_id": "IN",
      "name": "In-Network",
      "description": "The document prices a Designated Network and a Network column separately; this file carries the Designated Network ('you will pay the least') values where they differ. See source_references."
    },
    {
      "tier_id": "OUT",
      "name": "Out-of-Network",
      "description": "Out-of-network providers"
    }
  ],
  "accumulators": {
    "individual_deductible": {
      "amount": 1700,
      "currency": "USD",
      "period": "per_year",
      "network_tier": "in-network"
    },
    "family_deductible": {
      "amount": 3400,
      "currency": "USD",
      "period": "per_year",
      "network_tier": "in-network"
    },
    "oon_individual_deductible": {
      "amount": 5000,
      "currency": "USD",
      "period": "per_year",
      "network_tier": "out-of-network"
    },
    "oon_family_deductible": {
      "amount": 10000,
      "currency": "USD",
      "period": "per_year",
      "network_tier": "out-of-network"
    },
    "oon_individual_oop_max": {
      "amount": 10000,
      "currency": "USD",
      "period": "per_year",
      "network_tier": "out-of-network"
    },
    "oon_family_oop_max": {
      "amount": 20000,
      "currency": "USD",
      "period": "per_year",
      "network_tier": "out-of-network"
    },
    "individual_oop_max": {
      "amount": 4500,
      "currency": "USD",
      "period": "per_year",
      "network_tier": "in-network"
    },
    "family_oop_max": {
      "amount": 9000,
      "currency": "USD",
      "period": "per_year",
      "network_tier": "in-network"
    }
  },
  "benefits": [
    {
      "benefit_id": "PRIMARY_CARE",
      "benefit_type": "medical",
      "category": "PHYSICIAN_SERVICES",
      "service_name": "Primary care visit",
      "canonical_key": "primary_care",
      "raw_label": "Primary care visit to treat an injury or illness",
      "network_cost_shares": [
        {
          "tier_id": "IN",
          "covered": true,
          "cost_shares": [
            {
              "type": "copay",
              "sequence": 1,
              "amount": 10,
              "basis": "per_visit",
              "applies_to_deductible": false,
              "applies_to_moop": true
            }
          ]
        },
        {
          "tier_id": "OUT",
          "covered": true,
          "cost_shares": [
            {
              "type": "coinsurance",
              "sequence": 1,
              "rate": 0.4,
              "basis": "allowed_amount",
              "applies_to_deductible": true,
              "applies_to_moop": true
            }
          ]
        }
      ],
      "limits": [],
      "conditions": [],
      "moop_applicability": "plan_default"
    },
    {
      "benefit_id": "SPECIALIST",
      "benefit_type": "medical",
      "category": "PHYSICIAN_SERVICES",
      "service_name": "Specialist visit",
      "canonical_key": "specialist",
      "raw_label": "Specialist visit",
      "network_cost_shares": [
        {
          "tier_id": "IN",
          "covered": true,
          "cost_shares": [
            {
              "type": "copay",
              "sequence": 1,
              "amount": 30,
              "basis": "per_visit",
              "applies_to_deductible": false,
              "applies_to_moop": true
            }
          ]
        },
        {
          "tier_id": "OUT",
          "covered": true,
          "cost_shares": [
            {
              "type": "coinsurance",
              "sequence": 1,
              "rate": 0.4,
              "basis": "allowed_amount",
              "applies_to_deductible": true,
              "applies_to_moop": true
            }
          ]
        }
      ],
      "limits": [],
      "conditions": [],
      "moop_applicability": "plan_default"
    },
    {
      "benefit_id": "PREVENTIVE_CARE",
      "benefit_type": "medical",
      "category": "PREVENTIVE_CARE",
      "service_name": "Preventive care",
      "canonical_key": "preventive_care",
      "raw_label": "Preventive care/screening/ immunization",
      "network_cost_shares": [
        {
          "tier_id": "IN",
          "covered": true,
          "cost_shares": [
            {
              "type": "copay",
              "sequence": 1,
              "amount": 0,
              "basis": "per_visit",
              "applies_to_deductible": false,
              "applies_to_moop": true
            }
          ]
        },
        {
          "tier_id": "OUT",
          "covered": false,
          "cost_shares": []
        }
      ],
      "limits": [],
      "conditions": [],
      "moop_applicability": "plan_default"
    },
    {
      "benefit_id": "DIAGNOSTIC_TEST",
      "benefit_type": "medical",
      "category": "DIAGNOSTIC_SERVICES",
      "service_name": "Diagnostic test",
      "canonical_key": "diagnostic_test",
      "raw_label": "Diagnostic test (x-ray, blood work)",
      "network_cost_shares": [
        {
          "tier_id": "IN",
          "covered": true,
          "cost_shares": [
            {
              "type": "copay",
              "sequence": 1,
              "amount": 30,
              "basis": "per_visit",
              "applies_to_deductible": false,
              "applies_to_moop": true
            },
            {
              "type": "coinsurance",
              "sequence": 2,
              "rate": 0.0,
              "basis": "allowed_amount",
              "applies_to_deductible": true,
              "applies_to_moop": true
            }
          ]
        },
        {
          "tier_id": "OUT",
          "covered": true,
          "cost_shares": [
            {
              "type": "coinsurance",
              "sequence": 1,
              "rate": 0.4,
              "basis": "allowed_amount",
              "applies_to_deductible": true,
              "applies_to_moop": true
            }
          ]
        }
      ],
      "limits": [],
      "conditions": [],
      "moop_applicability": "plan_default"
    },
    {
      "benefit_id": "IMAGING_ADVANCED",
      "benefit_type": "medical",
      "category": "DIAGNOSTIC_SERVICES",
      "service_name": "Advanced imaging",
      "canonical_key": "imaging_advanced",
      "raw_label": "Imaging (CT/PET scans, MRIs)",
      "network_cost_shares": [
        {
          "tier_id": "IN",
          "covered": true,
          "cost_shares": [
            {
              "type": "copay",
              "sequence": 1,
              "amount": 150,
              "basis": "per_visit",
              "applies_to_deductible": false,
              "applies_to_moop": true
            }
          ]
        },
        {
          "tier_id": "OUT",
          "covered": true,
          "cost_shares": [
            {
              "type": "coinsurance",
              "sequence": 1,
              "rate": 0.4,
              "basis": "allowed_amount",
              "applies_to_deductible": true,
              "applies_to_moop": true
            }
          ]
        }
      ],
      "limits": [],
      "conditions": [],
      "moop_applicability": "plan_default"
    },
    {
      "benefit_id": "GENERIC_DRUGS",
      "benefit_type": "pharmacy",
      "category": "PHARMACY",
      "service_name": "Generic drugs",
      "canonical_key": "generic_drugs",
      "raw_label": "Tier 1 - Your Lowest- Cost Option",
      "network_cost_shares": [
        {
          "tier_id": "IN",
          "covered": true,
          "cost_shares": [
            {
              "type": "copay",
              "sequence": 1,
              "amount": 10,
              "basis": "per_prescription",
              "applies_to_deductible": false,
              "applies_to_moop": true
            }
          ]
        },
        {
          "tier_id": "OUT",
          "covered": true,
          "cost_shares": [
            {
              "type": "copay",
              "sequence": 1,
              "amount": 10,
              "basis": "per_prescription",
              "applies_to_deductible": false,
              "applies_to_moop": true
            }
          ]
        }
      ],
      "limits": [],
      "conditions": [],
      "moop_applicability": "plan_default"
    },
    {
      "benefit_id": "PREFERRED_BRAND_DRUGS",
      "benefit_type": "pharmacy",
      "category": "PHARMACY",
      "service_name": "Preferred brand drugs",
      "canonical_key": "preferred_brand_drugs",
      "raw_label": "Tier 2 - Your Midrange-Cost Option",
      "network_cost_shares": [
        {
          "tier_id": "IN",
          "covered": true,
          "cost_shares": [
            {
              "type": "copay",
              "sequence": 1,
              "amount": 40,
              "basis": "per_prescription",
              "applies_to_deductible": false,
              "applies_to_moop": true
            }
          ]
        },
        {
          "tier_id": "OUT",
          "covered": true,
          "cost_shares": [
            {
              "type": "copay",
              "sequence": 1,
              "amount": 40,
              "basis": "per_prescription",
              "applies_to_deductible": false,
              "applies_to_moop": true
            }
          ]
        }
      ],
      "limits": [],
      "conditions": [],
      "moop_applicability": "plan_default"
    },
    {
      "benefit_id": "NONPREFERRED_BRAND_DRUGS",
      "benefit_type": "pharmacy",
      "category": "PHARMACY",
      "service_name": "Non-preferred brand drugs",
      "canonical_key": "nonpreferred_brand_drugs",
      "raw_label": "Tier 3 - Your Midrange-Cost Option",